mysql> CREATE
DATABASE CollegeDB; ,mysql>
CREATE DATABASE StoreDB;
Query OK, 1 row affected (0.02 sec)
mysql> USE StoreDB;
Database changed
2. CREATE TABLE PRODUCTS: mysql>
CREATE TABLE Products ( ->
ProductID INT PRIMARY KEY,
-> ProductName VARCHAR(50),
-> Price DECIMAL(10, 2),
-> Quantity INT
-> );
Query OK, 0 rows affected (0.06 sec)
3. TRIGGER CREATION: mysql>
DELIMITER $$ mysql> mysql> CREATE
TRIGGER trg_Product_Insert
-> BEFORE INSERT ON Products
-> FOR EACH ROW
-> BEGIN
-> IF NEW.Price > 1000 THEN
-> SIGNAL SQLSTATE '45000'
-> SET MESSAGE_TEXT = 'Price cannot exceed 1000';
-> END IF;
-> END $$
Query OK, 0 rows affected (0.04 sec)
Ex No: 8 TRIGGERS FOR OPERATIONS IN DATABASE TABLE
mysql>
mysql> DELIMITER ;
4. TEST INSERT TRIGGER: mysql>
-- Successful insert
mysql> INSERT INTO Products VALUES (1, 'Product A', 500, 10);
Query OK, 1 row affected (0.04 sec)
mysql> mysql> --
Successful insert
mysql> INSERT INTO Products VALUES (2, 'Product B', 200, 15);
Query OK, 1 row affected (0.01 sec)
mysql> mysql> --
Successful insert
mysql> INSERT INTO Products VALUES (3, 'Product C', 300, 20);
Query OK, 1 row affected (0.00 sec)
mysql> mysql> --
Failing insert
mysql> INSERT INTO Products VALUES (4, 'Product X', 1500, 5);
ERROR 1644 (45000): Price cannot exceed 1000 mysql> -- Error:
Price cannot exceed 1000
5. TRIGGER CREATION: mysql> DELIMITER $$
mysql> mysql> CREATE TRIGGER
trg_Product_Update
-> BEFORE UPDATE ON Products
-> FOR EACH ROW
-> BEGIN
-> DECLARE msg VARCHAR(255);
-> SET msg = CONCAT('Product Price Changed: Old = ', OLD.Price, ', New
= ', NEW.Price);
-> INSERT INTO ProductLogs(EventType, EventDetails, EventTime)
-> VALUES ('UPDATE', msg, NOW());
-> END $$
Query OK, 0 rows affected (0.04 sec)
mysql>
mysql> DELIMITER ;
6. CREATE LOG TABLE:
mysql> CREATE TABLE ProductLogs (
-> LogID INT AUTO_INCREMENT PRIMARY KEY,
-> EventType VARCHAR(20),
-> EventDetails TEXT,
-> EventTime TIMESTAMP DEFAULT CURRENT_TIMESTAMP
-> );
Query OK, 0 rows affected (0.03 sec)
7. TEST UPDATE TRIGGER:
mysql> UPDATE Products SET Price = 600 WHERE ProductID = 3;
Query OK, 1 row affected (0.04 sec)
Rows matched: 1 Changed: 1 Warnings: 0
mysql> mysql> SELECT * FROM
ProductLogs;
+-------+-----------+---------------------------------------------------+---------------------+ |
LogID | EventType | EventDetails | EventTime |
+-------+-----------+---------------------------------------------------+---------------------+
| 1 | UPDATE | Product Price Changed: Old = 300.00, New = 600.00 | 2025-
08-23 23:05:40 |
+-------+-----------+---------------------------------------------------+---------------------+
1 row in set (0.00 sec)
8. TRIGGER CREATION: mysql> DELIMITER $$ mysql> mysql> CREATE
TRIGGER trg_Product_Delete
-> BEFORE DELETE ON Products
-> FOR EACH ROW
-> BEGIN
-> DECLARE msg VARCHAR(255);
-> SET msg = CONCAT('Product with ID ', OLD.ProductID, ' deleted.');
-> INSERT INTO ProductLogs(EventType, EventDetails, EventTime)
-> VALUES ('DELETE', msg, NOW());
-> END $$
Query OK, 0 rows affected (0.04 sec)
mysql>
mysql> DELIMITER ;
9. TEST DELETE TRIGGER:
mysql> DELETE FROM Products WHERE ProductID = 2;
Query OK, 1 row affected (0.04 sec)
mysql> mysql> SELECT * FROM
ProductLogs;
+-------+-----------+---------------------------------------------------+---------------------+
| LogID | EventType | EventDetails | EventTime | +----
---+-----------+---------------------------------------------------+---------------------+
| 1 | UPDATE | Product Price Changed: Old = 300.00, New = 600.00 | 2025-
08-23 23:05:40 |
| 2 | DELETE | Product with ID 2 deleted. | 2025-08-23 23:07:23
|
+-------+-----------+---------------------------------------------------+---------------------+
2 rows in set (0.00 sec)
10. PRODUCTS TABLE:
mysql> SELECT * FROM Products;
+-----------+-------------+--------+----------+
| ProductID | ProductName | Price | Quantity |
+-----------+-------------+--------+----------+
| 1 | Product A | 500.00 | 10 |
| 3 | Product C | 600.00 | 20 |
+-----------+-------------+--------+----------+
2 rows in set (0.00 sec)
11. PRODUCTLOGS TABLE:
mysql> SELECT * FROM ProductLogs;
+-------+-----------+---------------------------------------------------+---------------------+ |
LogID | EventType | EventDetails | EventTime |
+-------+-----------+---------------------------------------------------+---------------------+
| 1 | UPDATE | Product Price Changed: Old = 300.00, New = 600.00 | 2025-
08-23 23:05:40 |
| 2 | DELETE | Product with ID 2 deleted. | 2025-08-23 23:07:23
|
+-------+-----------+---------------------------------------------------+---------------------+
2 rows in set (0.00 sec) 
Query OK, 1 row affected (0.01 sec)
mysql> USE CollegeDB;
Database changed
2. CREATE TABLE DEPARTMENTS: mysql> CREATE TABLE
Departments ( -> DeptID INT PRIMARY KEY,
-> DeptName VARCHAR(100),
-> StudentCount INT,
-> TeacherCount INT,
-> Classrooms INT,
-> Email VARCHAR(100)
-> );
Query OK, 0 rows affected (0.03 sec)
3. BEGIN TRANSACTION:
Ex No: 7 IMPLEMENTING DCL AND TCL COMMANDS
mysql> START TRANSACTION;
Query OK, 0 rows affected (0.00 sec)
4. INSERT RECORDS + SAVEPOINTS:
mysql> INSERT INTO Departments VALUES (1, 'Computer Science', 200, 15, 5,
'cs@college.edu');
Query OK, 1 row affected (0.00 sec)
mysql> SAVEPOINT sp1;
Query OK, 0 rows affected (0.00 sec)
mysql> mysql> INSERT INTO Departments VALUES (2, 'Information
Technology', 180,
12, 4, 'it@college.edu');
Query OK, 1 row affected (0.00 sec)
mysql> SAVEPOINT sp2;
Query OK, 0 rows affected (0.00 sec)
mysql> mysql> INSERT INTO Departments VALUES (3, 'Cyber Security',
150, 10, 6,
'cyber@college.edu');
Query OK, 1 row affected (0.00 sec)
mysql> SAVEPOINT sp3;
Query OK, 0 rows affected (0.00 sec)
mysql> mysql> INSERT INTO Departments VALUES (4, 'Electronics',
150, 10, 6,
'ece@college.edu');
Query OK, 1 row affected (0.00 sec)
5. VIEW ALL RECORDS:
mysql> SELECT * FROM Departments;
+--------+------------------------+--------------+--------------+------------+------------------
+
| DeptID | DeptName | StudentCount | TeacherCount | Classrooms | Email
|
+--------+------------------------+--------------+--------------+------------+------------------
+
| 1 | Computer Science | 200 | 15 | 5 | cs@college.edu |
| 2 | Information Technology | 180 | 12 | 4 | it@college.edu |
| 3 | Cyber Security | 150 | 10 | 6 | cyber@college.edu |
| 4 | Electronics | 150 | 10 | 6 | ece@college.edu |
+--------+------------------------+--------------+--------------+------------+------------------
+
4 rows in set (0.00 sec)
6. UPDATE SOME DATA:
mysql> UPDATE Departments SET StudentCount = 220 WHERE DeptID = 1;
Query OK, 1 row affected (0.00 sec)
Rows matched: 1 Changed: 1 Warnings: 0
mysql> UPDATE Departments SET StudentCount = 190 WHERE DeptID = 2;
Query OK, 1 row affected (0.00 sec)
Rows matched: 1 Changed: 1 Warnings: 0
mysql> SAVEPOINT sp4;
Query OK, 0 rows affected (0.00 sec)
7. ROLLBACK TO SAVEPOINT (UNDO LAST UPDATE):
mysql> ROLLBACK TO sp2;
Query OK, 0 rows affected (0.03 sec)
8. VIEW AFTER ROLLBACK:
mysql> SELECT * FROM Departments;
+--------+------------------------+--------------+--------------+------------+----------------+
| DeptID | DeptName | StudentCount | TeacherCount | Classrooms | Email
|
+--------+------------------------+--------------+--------------+------------+----------------+
| 1 | Computer Science | 200 | 15 | 5 | cs@college.edu |
| 2 | Information Technology | 180 | 12 | 4 | it@college.edu |
+--------+------------------------+--------------+--------------+------------+----------------+
2 rows in set (0.00 sec)
9. ADD NEW RECORD AND DELETE:
mysql> INSERT INTO Departments VALUES (5, 'Mechanical', 160, 11, 7,
'mech@college.edu');
Query OK, 1 row affected (0.00 sec)
mysql> DELETE FROM Departments WHERE DeptID = 2;
Query OK, 1 row affected (0.00 sec)
10. FINAL COMMIT: mysql> COMMIT;
Query OK, 0 rows affected (0.04 sec)
11. CREATE NEW USER:
mysql> CREATE USER 'dept_user'@'localhost' IDENTIFIED BY 'pass123';
Query OK, 0 rows affected (0.05 sec)
12. GRANT PRIVILEGES TO USER:
mysql> GRANT SELECT, INSERT ON CollegeDB.Departments TO
'dept_user'@'localhost';
Query OK, 0 rows affected (0.04 sec)
13. SWITCH USER IN COMMAND LINE: mysql> mysql -u dept_user -p -> USE
CollegeDB; mysql> SELECT * FROM Departments;
+--------+------------------+--------------+--------------+------------+------------------+
| DeptID | DeptName | StudentCount | TeacherCount | Classrooms | Email
|
+--------+------------------+--------------+--------------+------------+------------------+
| 1 | Computer Science | 200 | 15 | 5 | cs@college.edu |
| 5 | Mechanical | 160 | 11 | 7 | mech@college.edu |
+--------+------------------+--------------+--------------+------------+------------------+ 2
rows in set (0.00 sec)
mysql> INSERT INTO Departments VALUES (6, 'Artificial Intelligence', 140, 9,
4, 'ai@college.edu');
Query OK, 1 row affected (0.01 sec)
mysql> DELETE FROM Departments WHERE DeptID = 1;
Query OK, 1 row affected (0.04 sec)
mysql> -- ERROR 1142 (42000): DELETE command denied to user
'dept_user'@'localhost'
14. GRANT ADDITIONAL PRIVILEGES (FROM ROOT):
mysql> GRANT DELETE, UPDATE ON CollegeDB.Departments TO
'dept_user'@'localhost';
Query OK, 0 rows affected (0.04 sec)
15. REVOKE ALL PERMISSIONS: mysql> REVOKE DELETE, INSERT, UPDATE
ON CollegeDB.Departments
FROM 'dept_user'@'localhost';
Query OK, 0 rows affected (0.01 sec)
16. DROP USER:
mysql> DROP USER 'dept_user'@'localhost'; Query
OK, 0 rows affected (0.04 sec

